key,name,unsettling_description,original_description
706,Shad,TODO,"Lives in a school at sea, but returns to the rivers to spawn."
707,Lingcod,TODO,A fearsome predator that will eat almost anything it can cram into its mouth.
708,Halibut,"Born with an eye on each side of its head, one eye slowly migrates across as it grows.",A flat fish that lives on the ocean floor.
709,Hardwood,A formidable length of hardened wood. Very pleasing to the touch.,A special kind of wood with superior strength and beauty.
710,Crab Pot,TODO,"Place it in the water, load it with bait, and check the next day to see if you've caught anything. Works in streams, lakes, and the ocean."
715,Lobster,TODO,A large ocean-dwelling crustacean with a strong tail.
716,Crayfish,TODO,A small freshwater relative of the lobster.
717,Crab,"A sea spider, ready to be boiled alive and eaten fresh.",A marine crustacean with two powerful pincers.
718,Cockle,TODO,A common saltwater clam.
719,Mussel,TODO,A common bivalve that often lives in clusters.
720,Shrimp,TODO,A scavenger that feeds off the ocean floor. Widely prized for its meat.
721,Snail,TODO,A wide-ranging mollusc that lives in a spiral shell.
722,Periwinkle,TODO,A tiny freshwater snail that lives in a blue shell.
723,Oyster,A slimy-feeling shell means this creature is still alive.,"Constantly filters water to find food. In the process, it removes dangerous toxins from the environment."
724,Maple Syrup,"The sweet life-blood of maple trees, extracted for consumption.",A sweet syrup with a unique flavor.
725,Oak Resin,"The innards of an oak tree, extracted and processed for use.","A sticky, fragrant substance derived from oak sap."
726,Pine Tar,TODO,A pungent substance derived from pine sap.
727,Chowder,TODO,A perfect way to warm yourself after a cold night at sea.
730,Lobster Bisque,Some say you can hear the lobster scream as it is boiled alive. Others say it is just the sound of steam escaping.,This delicate soup is a secret family recipe of Willy's.
728,Fish Stew,TODO,"It smells a lot like the sea. Tastes better, though."
729,Escargot,"It may have a fancy French name, but it's still just snails.",Butter-soaked snails cooked to perfection.
731,Maple Bar,TODO,It's a sweet doughnut topped with a rich maple glaze.
732,Crab Cakes,TODO,"Crab, bread crumbs, and egg formed into patties then fried to a golden brown."
733,Shrimp Cocktail,"Delicious, drinkable invertebrates, freshly-caught.",A sumptuous appetizer made with freshly-caught shrimp.
734,Woodskip,TODO,A very sensitive fish that can only live in pools deep in the forest.
745,Strawberry Seeds,TODO,"Plant these in spring. Takes 8 days to mature, and keeps producing strawberries after that."
746,Jack-O-Lantern,Vegetable craniotomy victim. Place its leering skull in a visible location as a warning to others.,A whimsical fall decoration.
747,Rotten Plant,Flies have laid eggs in the putrid mass. You should probably get rid of this.,Decomposing organic material. It's slimy and unpleasant.
748,Rotten Plant,Something wriggles just under the surface. You should probably get rid of this.,Decomposing organic material. It's slimy and unpleasant.
749,Omni Geode,"Ask a blacksmith to shatter this poor rock, then toss it aside for the treasure within. So many possibilities!",A blacksmith can break this open for you. These geodes contain a wide variety of Minerals.
750,Weeds,UNOBTAINABLE,Ugly weeds.
751,Stone,UNOBTAINABLE,There's copper ore in this stone.
760,Stone,UNOBTAINABLE,...
762,Stone,UNOBTAINABLE,...
764,Stone,UNOBTAINABLE,gold ore
765,Stone,UNOBTAINABLE,iridium ore
766,Slime,You're not sure which organ this gelatinous substance is from.,"A shimmering, gelatinous glob with no smell."
767,Bat Wing,It's still twitching after being sliced off from the body.,The material is surprisingly delicate.
768,Solar Essence,A warm remnant of Yoba's power.,The glowing face is warm to the touch.
769,Void Essence,TODO,It's quivering with dark energy.
770,Mixed Seeds,"There's a little bit of everything in here! Not just seeds... there's a few dead bugs and animal droppings, too.",There's a little bit of everything here. Plant them and see what grows!
771,Fiber,Better check it for animal droppings.,Raw material sourced from plants.
772,Oil of Garlic,"You'll ooze garlic from every pore, producing a pungent odor that is frightful to weaker monsters.",Drink this and weaker monsters will avoid you.
773,Life Elixir,TODO,Restores health to full.
774,Wild Bait,Bug corpses held together with Linus' special sauce.,A unique recipe from Linus that gives you a chance to catch two fish at once.
775,Glacierfish,TODO,Builds a nest on the underside of glaciers.
784,Weeds,UNOBTAINABLE,Ugly weeds.
785,Weeds,UNOBTAINABLE,Ugly weeds.
786,Weeds,UNOBTAINABLE,Ugly weeds.
787,Battery Pack,Lightning-powered. It's probably safe.,It's fully charged with precious energy.
788,Lost Axe,"The axe cries out for its owner. Faintly you can hear it whisper, ""Robin...""",Robin's been looking everywhere for it.
789,Lucky Purple Shorts,Most definitely unwashed.,Better not inspect these too closely.
790,Berry Basket,"Stained with what you *hope* is berry juice. It smells like Linus, and he smells awful.",The fibers are stained with berry juice.
792,Weeds,UNOBTAINABLE,Ugly weeds.
793,Weeds,UNOBTAINABLE,Ugly weeds.
794,Weeds,UNOBTAINABLE,Ugly weeds.
795,Void Salmon,"Shadows have mutated this species beyond repair. Keep an eye out behind you, you could be next.","A salmon, twisted by void energy. The fresh meat is jet black, but rapidly turns pink when exposed to air."
796,Slimejack,TODO,He's coated in a very thick layer of slime. He keeps slipping out of your hands!
797,Pearl,"A grain of sand that irritated an oyster until it spit on it again, and again, and again. Very beautiful.",A rare treasure from the sea.
798,Midnight Squid,TODO,A strange and mysterious denizen of the ocean's twilight depths.
799,Spook Fish,TODO,The huge eyes can detect the faint silhouettes of prey.
800,Blobfish,A fish rapidly pulled from its deep-sea home. The changing pressures have almost turned it inside-out.,"This odd creature floats above the ocean floor, consuming any edible material in its path."
801,Wedding Ring,"Binds your partner's soul to yours, 'til death do you part.",An old Zuzu City tradition... It's used to ask for another farmer's hand in marriage.
802,Cactus Seeds,"Grows a spiny plant with a nasty defense system. Plant indoors only, 12 days, reharvestable.","Can only be grown indoors. Takes 12 days to mature, and then produces fruit every 3 days."
803,Iridium Milk,NON-INVENTORY,A powerful 'milk' of unknown origin...
805,Tree Fertilizer,TODO,"Sprinkle on a wild tree to ensure rapid growth, even in winter. Doesn't work on fruit trees."
807,Dinosaur Mayonnaise,"Yum, dead dinosaur babies!","It's thick and creamy, with a vivid green hue. It smells like grass and leather."
808,Void Ghost Pendant,TODO,"It's symoblic to the shadow people. As a gift, it signifies the desire to move in together as friends."
809,Movie Ticket,Sit with strangers in the dark and pretend the room isn't gassed up with farts. Give one to a friend!,Admits one to the movie theater. Giving this to a friend invites them to the movies with you.
810,Crabshell Ring,"The enchanted shell might protect you, but it certainly didn't protect the crab.",The top of the ring is made from enchanted crab shell.
811,Napalm Ring,Explodes enemy corpses. Violently. Wear it on a finger!,"When you defeat an enemy, they explode."
812,Roe,You can see tiny baby fish inside. Alive and wiggling. Age them in a preserves jar to bring out more flavor.,Fresh fish eggs. These can be aged in a preserves jar to bring out more flavor.
445,Caviar,"The salted, unborn offspring of an endangered fish species. A luxurious delicacy!",The cured roe of a sturgeon fish. Considered to be a luxurious delicacy!
814,Squid Ink,TODO,Squid use this ink to confuse would-be predators.
815,Tea Leaves,TODO,"The young leaves of the tea plant. Can be brewed into the popular, energizing beverage."
267,Flounder,Two eyes on one side of its head and none on the other. It wasn't born that way.,"It lives on the bottom, so both eyes are on top of its head."
265,Seafoam Pudding,Waterlogged and briny. There's no going back if you eat this.,This briny pudding will really get you into the maritime mindset!
269,Midnight Carp,TODO,This shy fish only feels comfortable at night.