key,name,unsettling_description,original_description
0,Weeds,UNOBTAINABLE,A bunch of obnoxious weeds.
2,Stone,UNOBTAINABLE,A useful material when broken with the Pickaxe.
4,Stone,UNOBTAINABLE,A useful material when chopped with the axe.
16,Wild Horseradish,"A hotly pungent, fleshy root. Crushing or grinding it releases the flavor and heat.",A spicy root found in the spring.
18,Daffodil,TODO,A traditional spring flower that makes a nice gift.
20,Leek,Some wild animal marked its territory on this one.,A tasty relative of the onion.
22,Dandelion,The leaves are a powerful diuretic; eating them increases urine production.,"Not the prettiest flower, but the leaves make a good salad."
24,Parsnip,"It has all the flavor of a bleached, long-dead carrot.",A spring tuber closely related to the carrot. It has an earthy taste and is full of nutrients.
30,Lumber,UNOBTAINABLE,A versatile resource used for building and fuel.
60,Emerald,This gem is thought to guard against memory loss. A thoughtful gift for divorcees.,A precious stone with a brilliant green color.
62,Aquamarine,Thought to protect against seasickness and tragic sailing accidents.,A shimmery blue-green gem.
64,Ruby,"The ""pigeon's blood"" variety of this gem is its most sought-after color variant.",A precious stone that is sought after for its rich color and beautiful luster.
66,Amethyst,Some sources suggest that this stone is used to stabilize mental disorders.,A purple variant of quartz.
68,Topaz,"When worn as a necklace, this gemstone is believed to drive away sadness.",Fairly common but still prized for its beauty.
70,Jade,"In many cultures, this stone has a strong association with the dead.",A pale green ornamental stone.
71,Trimmed Lucky Purple Shorts,The mayor's used silk shorts. They look better on you than on Marnie's floor.,Purple silk shorts trimmed in luxurious gold...
72,Diamond,This one seems to be clear of blood.,A rare and valuable gem.
74,Prismatic Shard,TODO,A very rare and powerful substance with unknown origins.
75,Stone,UNOBTAINABLE,...
76,Stone,UNOBTAINABLE,...
77,Stone,UNOBTAINABLE,...
78,Cave Carrot,A dirtier variety of carrot. Fulfills many needs of a miner.,A starchy snack found in caves. It helps miners work longer.
79,Secret Note,TODO,"It's old and crumpled, but if you look closely you can make out the details..."
80,Quartz,TODO,A clear crystal commonly found in caves and mines.
82,Fire Quartz,TODO,A glowing red crystal commonly found near hot lava.
84,Frozen Tear,The last remnant of some long forgotten creature.,A crystal fabled to be the frozen tears of a yeti.
86,Earth Crystal,An item commonly gifted by cheapskates.,A resinous substance found near the surface.
88,Coconut,"Covered in rough hair, it provides both milk and meat.",A seed of the coconut palm. It has many culinary uses.
90,Cactus Fruit,You'd have to spend a long time under the desert sun to consider this fruit edible.,The sweet fruit of the prickly pear cactus.
92,Sap,Tree blood. It's still sticky.,A fluid obtained from trees.
93,Torch,"Flickers suddenly from time to time, even when there is no breeze.",Provides a modest amount of light.
94,Spirit Torch,UNOBTAINABLE,It's unclear where the blue color comes from...
96,Dwarf Scroll I,"A scroll written in an ancient language... it probably isn't calling for genocide of surface dwellers, right?",A yellowed scroll of parchment filled with dwarven script. This one's tied with a red bow.
97,Dwarf Scroll II,"A scroll written in an ancient language, describing a species that never expected to become endangered.",A yellowed scroll of parchment filled with dwarven script. This one's tied with a green ribbon.
98,Dwarf Scroll III,"A scroll written in an ancient language, the writer unaware their days were numbered.",A yellowed scroll of parchment filled with dwarven script. This one's tied with a blue rope.
99,Dwarf Scroll IV,A scroll written in an ancient language. Did they know the end was coming?,A yellowed scroll of parchment filled with dwarven script. This one's tied with a golden chain.
100,Chipped Amphora,Hopefully not used in any sacrificial rituals.,An ancient vessel made of ceramic material. Used to transport both dry and wet goods.
101,Arrowhead,TODO,A crudely fashioned point used for hunting.
102,Lost Book,NON-INVENTORY,Writings from a wide variety of time periods.
103,Ancient Doll,"When left out of sight, this doll is rumored to change position on its own.","An ancient doll covered in grime. This doll may have been used as a toy, a decoration, or a prop in some kind of ritual."
104,Elvish Jewelry,Legend says they are enchanted to be as warm as their owners. It's cold to the touch.,Dirty but still beautiful. On the side is a flowing script thought by some to be the ancient language of the elves. No Elvish bones have ever been found.
105,Chewing Stick,You can still taste what the last person who used it had for lunch.,Ancient people chewed on these to keep their teeth clean.
106,Ornamental Fan,TODO,This exquisute fan most likely belonged to a noblewoman. Historians believe that the valley was a popular sixth-era vacation spot for the wealthy.
107,Dinosaur Egg,Perhaps it can still hatch... what could go wrong?,A giant dino egg... The entire shell is still intact!
108,Rare Disc,TODO,"A heavy black disc studded with peculiar red stones. When you hold it, you're overwhelmed with a feeling of dread."
109,Ancient Sword,"The sword may be in bad shape, but it has far outlived its owner.","It's the remains of an ancient sword. Most of the blade has turned to rust, but the hilt is very finely crafted."
110,Rusty Spoon,"Despite its normal shape, I wouldn't use it for breakfast.","A plain old spoon, probably ten years old. Not very interesting."
111,Rusty Spur,TODO,An old spur that was once attached to a cowboy's boot. People must have been raising animals in this area for many generations.
112,Rusty Cog,"It reminds you of your old workplace, somehow.",A well preserved cog that must have been part of some ancient machine. This could be dwarven technology.
113,Chicken Statue,A mummified chicken in pristine condition. When you shake it you can hear small bones rattling inside.,It's a statue of a chicken on a bronze base. The ancient people of this area must have been very fond of chickens.
114,Ancient Seed,TODO,It's a dry old seed from some ancient plant. By all appearances it's long since dead...
115,Prehistoric Tool,TODO,Some kind of gnarly old digging tool.
116,Dried Starfish,"Some believe that starfish scream as the sun dries them out, but only fish can hear their piercing cries.",A starfish from the primordial ocean. It's an unusually pristine specimen!
117,Anchor,TODO,It may have belonged to ancient pirates.
118,Glass Shards,They almost look like candy.,A mixture of glass shards smoothed by centuries of ocean surf. These could have belonged to an ancient mosaic or necklace.
119,Bone Flute,"Imagine blowing some ancient creature's dirty, bacteria-filled tibia. Bone flute!",It's a prehistoric wind instrument carved from an animal's bone. It produces an eerie tone.
120,Prehistoric Handaxe,TODO,"One of the earliest tools employed by humans. This ""crude"" tool was created by striking one rock with another to form a sharp edge."
121,Dwarvish Helm,"It's sturdy, but even the best armor didn't prevent their near-extinction.",It's one of the helmets commonly worn by dwarves. The thick metal plating protects them from falling debris and stalactites.
122,Dwarf Gadget,"The strange crystalline screen stays lit, but shows only static.","It's a piece of the advanced technology once known to the dwarves. It's still glowing and humming, but you're unable to understand how it works."
123,Ancient Drum,Looks like skin stretched over bone. Nice sound though.,"It's a drum made from wood and animal skin. It has a low, reverberating tone."
124,Golden Mask,TODO,A creepy golden mask probably used in an ancient magic ritual. A socket in the forehead contains a large purple gemstone.
125,Golden Relic,TODO,It's a golden slab with heiroglyphs and pictures emblazoned onto the front.
126,Strange Doll,It just wants to spend your whole life with you.,???
127,Strange Doll,What a beautiful smile you have.,???
128,Pufferfish,"Expands to stab with poisonous spines when threatened. Its cousin, the pufferchick, is much more friendly.",Inflates when threatened.
129,Anchovy,Suspected of ruining many a soup.,A small silver fish found in the ocean.
130,Tuna,TODO,A large fish that lives in the ocean.
131,Sardine,TODO,A common ocean fish.
132,Bream,TODO,A fairly common river fish that becomes active at night.
136,Largemouth Bass,TODO,A popular fish that lives in lakes.
137,Smallmouth Bass,TODO,A freshwater fish that is very sensitive to pollution.
138,Rainbow Trout,TODO,A freshwater trout with colorful markings.
139,Salmon,"In fall, these fish swim miles upstream and die just to mate.",Swims upstream to lay its eggs.
140,Walleye,TODO,A freshwater fish caught at night.
141,Perch,TODO,A freshwater fish of the winter.
142,Carp,TODO,A common pond fish.
143,Catfish,This ugly bottom-feeder will eat just about anything.,An uncommon fish found in streams.
144,Pike,TODO,A freshwater fish that's difficult to catch.
145,Sunfish,TODO,A common river fish.
146,Red Mullet,TODO,Long ago these were kept as pets.
147,Herring,TODO,A common ocean fish.
148,Eel,Wriggles and writhes just like some long organ.,"A long, slippery little fish."
149,Octopus,"The tentacles give a tingly, suckling sensation.",A mysterious and intelligent creature.
150,Red Snapper,TODO,A popular fish with a nice red color.
151,Squid,"These soft-bodied animals are known to be incredibly intelligent. Still, delicious.",A deep sea creature that can grow to enormous size.
152,Seaweed,TODO,It can be used in cooking.
153,Green Algae,"The consistency of cold snot, with the occasional satisfying crunch.",It's really slimy.
154,Sea Cucumber,TODO,"A slippery, slimy creature found on the ocean floor."
155,Super Cucumber,TODO,"A rare, purple variety of sea cucumber."
156,Ghostfish,Should have left it in the water...,"A pale, blind fish found in underground lakes."
157,White Algae,It leaves a fragrant white film on your hands.,It's super slimy.
158,Stonefish,TODO,A bizarre fish that's shaped like a brick.
159,Crimsonfish,TODO,Lives deep in the ocean but likes to lay its eggs in the warm summer water.
160,Angler,This eerie fish is known for the sexual parasitism of its disturbing reproductive cycle.,Uses a bioluminescent dangler to attract prey.
161,Ice Pip,"A frozen, zombified fish. Don't let it bite you. You might be able to use it as a weapon, though.",A rare fish that thrives in extremely cold conditions.
162,Lava Eel,Legend says it survives by feeding off the remains of travelers who drown in the mines.,It can somehow survive in pools of red-hot lava.
163,Legend,"The grandfather of all largemouth bass in the lake, now torn from his home.",The king of all fish! They said he'd never be caught.
164,Sandfish,It hides using camouflage. Sometimes you can see the sand move as it waits for prey.,It tries to hide using camouflage.
165,Scorpion Carp,The unholy union of a scorpion and a carp. Keep hands away from tailfin!,It's like a regular carp but with a sharp stinger.
166,Treasure Chest,"Many of the coins inside are stained an ugly dark red, almost black.","Wow, it's loaded with treasure! This is sure to fetch a good price."
167,Joja Cola,Food safety authorities have questioned the blue chemical used to color this drink.,The flagship product of Joja corporation.
168,Trash,TODO,It's junk.
169,Driftwood,The weathered remnant of a drowned tree.,A piece of wood from the sea.
170,Broken Glasses,TODO,It looks like someone lost their glasses. They're busted.
171,Broken CD,"Faded blue marker on one side mentions ""blackmail"", but the rest is indiscernible.",It's a JojaNet 2.0 trial CD. They must've made a billion of these things.
172,Soggy Newspaper,Filled with propaganda and word vomit. Worthless.,This is trash.
176,Egg,A regular white egg. Fresh from a chicken's cloaca!,A regular white chicken egg.
174,Large Egg,An uncommonly large white egg. Can you imagine how the chicken must have stretched?,It's an uncommonly large white egg!
178,Hay,Delicious grass corpses for your animal friends.,Dried grass used as animal food.
180,Egg,A regular brown egg. Fresh from a chicken's cloaca!,A regular brown chicken egg.
182,Large Egg,An uncommonly large brown egg. Can you imagine how the chicken must have stretched?,It's an uncommonly large brown egg!
184,Milk,A jug of cow tiddy juice. Yum.,A jug of cow's milk.
186,Large Milk,Voluminous secretions from a bulging cow udder.,A large jug of cow's milk.
188,Green Bean,TODO,"A juicy little bean with a cool, crisp snap."
190,Cauliflower,TODO,"Valuable, but slow-growing. Despite its pale color, the florets are packed with nutrients."
191,Ornate Necklace,TODO,A fancy necklace found in the water outside of the bath house. It's still wet...
192,Potato,"It doesn't seem like much, but you'd be glad of it in a famine.",A widely cultivated tuber.
194,Fried Egg,Mmm~ unborn chicken cooked in crushed nut juice.,Sunny-side up.
195,Omelet,"Fluffy, congealed cow AND chicken juices. Are you gonna eat that?",It's super fluffy.
196,Salad,"Assorted dismembered plant materials, tossed with a flavorful dressing.",A healthy garden salad.
197,Cheese Cauliflower,Plants taste better with curdled cow juice on them.,It smells great!
198,Baked Fish,TODO,Baked fish on a bed of herbs.
199,Parsnip Soup,TODO,It's fresh and hearty.
200,Vegetable Medley,TODO,This is very nutritious.
201,Complete Breakfast,This would make a very satisfying last meal.,You'll feel ready to take on the world!
202,Fried Calamari,The sapient flesh is deliciously chewy.,It's so chewy.
203,Strange Bun,What's inside? OH SWEET YOBA IT'S SPIDERS!,What's inside?
204,Lucky Lunch,So tasty that luck-bringing spirits will nest in your belly to eat it.,A special little meal.
205,Fried Mushroom,You can still taste the dirt.,Earthy and aromatic.
206,Pizza,It has pineapples on it. *shudder*,It's popular for all the right reasons.
207,Bean Hotpot,TODO,It sure is healthy.
208,Glazed Yams,"If you can't stomach eating your vegetables, drown them in sugar first.",Sweet and satisfying... The sugar gives it a hint of caramel.
209,Carp Surprise,The carp is not the surprising part of this meal.,It's bland and oily.
210,Hashbrowns,TODO,Crispy and golden-brown!
211,Pancakes,TODO,"A double stack of fluffy, soft pancakes."
212,Salmon Dinner,Cooked flesh of a fish with a squirt of something yellow... thats what makes it special. ;),The lemon spritz makes it special.
213,Fish Taco,A fishy smell is normal for this taco.,It smells delicious.
214,Crispy Bass,TODO,"Wow, the breading is perfect."
215,Pepper Poppers,TODO,Spicy breaded peppers filled with cheese.
216,Bread,The greatest thing since the elves disappeared.,A crusty baguette.
218,Tom Kha Soup,TODO,These flavors are incredible!
219,Trout Soup,TODO,Pretty salty.
220,Chocolate Cake,Moist.,Rich and moist with a thick fudge icing.
221,Pink Cake,TODO,There's little heart candies on top.
222,Rhubarb Pie,TODO,"Mmm, tangy and sweet!"
223,Cookie,"Granny Evelyn's ""special"" cookies.",Very chewy.
224,Spaghetti,TODO,An old favorite.
225,Fried Eel,Greasy on the outside and mushy on the inside. At least it's no longer slimy.,Greasy but flavorful.
226,Spicy Eel,TODO,It's really spicy! Be careful.
227,Sashimi,TODO,Raw fish sliced into thin pieces.
228,Maki Roll,TODO,Fish and rice wrapped in seaweed.
229,Tortilla,TODO,Can be used as a vessel for food or eaten by itself.
230,Red Plate,TODO,Full of antioxidants.
231,Eggplant Parmesan,TODO,"Tangy, cheesy, and wonderful."
232,Rice Pudding,TODO,"It's creamy, sweet, and fun to eat."
233,Ice Cream,The taste brings to mind screaming children.,It's hard to find someone who doesn't like this.
234,Blueberry Tart,TODO,It's subtle and refreshing.
235,Autumn's Bounty,TODO,A taste of the season.
236,Pumpkin Soup,TODO,A seasonal favorite.
237,Super Meal,TODO,It's a really energizing meal.
238,Cranberry Sauce,The gelatinized corpses of countless cranberries. How could you?!,A festive treat.
239,Stuffing,"Oh, you'll be stuffed, all right.",Ahh... the smell of warm bread and sage.
240,Farmer's Lunch,TODO,This'll keep you going.
241,Survival Burger,A vegetarian alternative for the health-conscious cannibal.,A convenient snack for the explorer.
242,Dish O' The Sea,TODO,This'll keep you warm in the cold sea air.
243,Miner's Treat,TODO,This should keep your energy up.
244,Roots Platter,TODO,This'll get you digging for more.
245,Sugar,The leading cause of diabetes.,Adds sweetness to pastries and candies. Too much can be unhealthy.
246,Wheat Flour,TODO,A common cooking ingredient made from crushed wheat seeds.
247,Oil,A vital ingredient in fried food and clogged arteries.,All purpose cooking oil.
248,Garlic,Keeps the bloodsuckers away.,Adds a wonderful zestiness to dishes. High quality garlic can be pretty spicy.
250,Kale,TODO,The waxy leaves are great in soups and stir frys.
251,Tea Sapling,TODO,"Takes 20 days to mature. Produces tea leaves during the final week of each season, except winter. No watering necessary!"
252,Rhubarb,TODO,"The stalks are extremely tart, but make a great dessert when sweetened."
253,Triple Shot Espresso,"Causes irregular or rapid heartbeat in high doses. Just ignore it, it's probably fine.",It's more potent than regular coffee!
254,Melon,TODO,"A cool, sweet summer treat."
256,Tomato,"Belongs to the nightshade family, but don't worry, it's not poisonous.","Rich and slightly tangy, the Tomato has a wide variety of culinary uses."
257,Morel,TODO,Sought after for its unique nutty flavor.
258,Blueberry,TODO,A popular berry reported to have many health benefits. The blue skin has the highest nutrient concentration.
259,Fiddlehead Fern,TODO,The young shoots are an edible specialty.
260,Hot Pepper,It'll make your face melt.,Fiery hot with a hint of sweetness.
261,Warp Totem: Desert,Warps all time and space to re-center Calico Desert on your current physical location. Consumed on use.,Warp directly to Calico Desert. Consumed on use.
262,Wheat,TODO,One of the most widely cultivated grains. Makes a great flour for breads and cakes.
264,Radish,TODO,A crisp and refreshing root vegetable with hints of pepper when eaten raw.
266,Red Cabbage,TODO,Often used in salads and coleslaws. The color can range from purple to blue to green-yellow depending on soil conditions.
268,Starfruit,TODO,"An extremely juicy fruit that grows in hot, humid weather. Slightly sweet with a sour undertone."
270,Corn,TODO,"One of the most popular grains. The sweet, fresh cobs are a summer favorite."
271,Unmilled Rice,May cause avian stomachs to explode when eaten.,Rice in its rawest form. Run this through a mill to increase the value.
272,Eggplant,TODO,A rich and wholesome relative of the tomato. Delicious fried or stewed.
273,Rice Shoot,TODO,Plant these in the spring. Takes 8 days to mature. Grows faster if planted near a body of water. Harvest with the scythe.
274,Artichoke,Harvested without slave labour.,"The bud of a thistle plant. The spiny outer leaves conceal a fleshy, filling interior."
275,Artifact Trove,Be careful breaking this open. You could get an artifact... or unleash a very angry specter.,A blacksmith can open this for you. These troves often contain ancient relics and curiosities.
276,Pumpkin,TODO,"A fall favorite, grown for its crunchy seeds and delicately flavored flesh. As a bonus, the hollow shell can be carved into a festive decoration."
277,Wilted Bouquet,TODO,A gift that shows you want to stop dating someone.
278,Bok Choy,TODO,The leafy greens and fibrous stalks are healthy and delicious.
279,Magic Rock Candy,Colorful candy made from literal rocks. Seems like something meant to trick children.,A rare and powerful candy infused with the essence of the prismatic shard.
280,Yam,TODO,A starchy tuber with a lot of culinary versatility.
281,Chanterelle,TODO,A tasty mushroom with a fruity smell and slightly peppery flavor.
282,Cranberries,TODO,These tart red berries are a traditional winter food.
283,Holly,"Crisp and juicy berries. Alas, some things are only edible once.",The leaves and bright red berries make a popular winter decoration.
284,Beet,TODO,"A sweet and earthy root vegatable. As a bonus, the leaves make a great salad."
286,Cherry Bomb,A small explosive device that is unfortunately tempting for small children.,Generates a small explosion. Stand back!
287,Bomb,A civilian version of a mass-produced explosive from the Gotoro war.,Generates an explosion. Watch out!
288,Mega Bomb,A devastatingly powerful bomb intended to inflict maximum damage and harm.,Generates a powerful explosion. Use with extreme caution.
290,Stone,UNOBTAINABLE,...
293,Brick Floor,"Chunks of brick can make decent weapons, in a pinch. Place on the ground to create paths or floors.",Place on the ground to create paths or to decorate your floors.
294,Twig,UNOBTAINABLE,...
295,Twig,UNOBTAINABLE,...
296,Salmonberry,The color is eerily similar to salmon... eggs.,A spring-time berry with the flavor of the forest.
297,Grass Starter,"Plant this for your animals to eat. When you scythe it, you can smell the grass screaming in pain as it dies.",Place this on your farm to start a new patch of grass.
298,Hardwood Fence,Makes a stronger prison than an iron fence.,The most durable type of fence.
299,Amaranth Seeds,TODO,Plant these in the fall. Takes 7 days to grow. Harvest with the scythe.
300,Amaranth,A purple grain like a thousand years old. Good luck actually enjoying this dust.,A purple grain cultivated by an ancient civilization.
301,Grape Starter,"TODO Plant in fall, 10 days, reharvestable. Trellis crop.","Plant these in the fall. Takes 10 days to grow, but keeps producing after that. Grows on a trellis."
302,Hops Starter,"TODO Plant in summer, 11 days, reharvestable. Trellis crop.","Plant these in the summer. Takes 11 days to grow, but keeps producing after that. Grows on a trellis."
303,Pale Ale,Drink before and after driving a bus if your name is Pam.,Drink in moderation.
304,Hops,TODO,"A bitter, tangy flower used to flavor beer."
305,Void Egg,Might give birth to the Darkness itself. Do you dare to let it hatch?,A jet-black egg with red flecks. It's warm to the touch.
306,Mayonnaise,Technically an oily egg yolk. Someone came up with this great idea!,It looks spreadable.
307,Duck Mayonnaise,Spreadable essence of unborn duck. Goes great in sandwiches.,"It's a rich, yellow mayonnaise."
308,Void Mayonnaise,"Your mortal, dimensionally finite stomach cannot hope to endure its unfathomable nutrients.","A thick, black paste that smells like burnt hair."
309,Acorn,TODO,Place this on your farm to plant an oak tree.
310,Maple Seed,A winged tree seed that bears uncanny resemblance to an insect.,Place this on your farm to plant a maple tree.
311,Pine Cone,Tiny ants crawl between the rough scales.,Place this on your farm to plant a pine tree.
313,Weeds,UNOBTAINABLE,...
314,Weeds,UNOBTAINABLE,...
315,Weeds,UNOBTAINABLE,...
316,Weeds,UNOBTAINABLE,...
317,Weeds,UNOBTAINABLE,...
318,Weeds,UNOBTAINABLE,...
319,Weeds,UNOBTAINABLE,...
320,Weeds,UNOBTAINABLE,...
321,Weeds,UNOBTAINABLE,...
322,Wood Fence,Keeps grass and animals imprisoned!,Keeps grass and animals contained!
323,Stone Fence,Makes a stronger prison than a wood fence.,Lasts longer than a wood fence.
324,Iron Fence,Makes a stronger prison than a stone fence.,Lasts longer than a stone fence.
325,Gate,TODO,Allows you to pass through a fence.
326,Dwarvish Translation Guide,NON-INVENTORY,Teaches you dwarvish.
328,Wood Floor,TODO,Place on the ground to create paths or to decorate your floors.
329,Stone Floor,TODO,Place on the ground to create paths or to spruce up your floors.
330,Clay,"Not very tasty, 0 out of 10. (2 out of 10 with rice)",Used in crafting and construction.
331,Weathered Floor,Deliberately crafted to give a haunted look. Place on the ground to create paths or floors.,Place on the ground to create paths or to spruce up your floors.
333,Crystal Floor,Has an unnaturally smooth surface. Place on the ground to create paths or floors.,Place on the ground to create paths or to spruce up your floors.
334,Copper Bar,TODO,A bar of pure copper.
335,Iron Bar,TODO,A bar of pure iron.
336,Gold Bar,TODO,A bar of pure gold.
337,Iridium Bar,TODO,A bar of pure iridium.
338,Refined Quartz,TODO,A more pure form of quartz.
340,Honey,"Bee spit. The bees use it to feed their young, so it should be fine for human consumption, right?",It's a sweet syrup produced by bees.
341,Tea Set,TODO,Fine porcelain.
342,Pickles,Jar of soggy vegetables left to cure in a pool of brine.,A jar of your home-made pickles.
343,Stone,UNOBTAINABLE,Stone.
344,Jelly,Gooey. Mayor Lewis would approve.,Gooey.
346,Beer,"Mm, you can really taste how old this liquid is!",Drink in moderation.
347,Rare Seed,TODO,Sow in fall. Takes all season to grow.
348,Wine,Drink to forget.,Drink in moderation.
349,Energy Tonic,This drug will give you the 'youthful' energy to go all night long!,Restores a lot of energy.
350,Juice,Life-blood squeezed from vegetables for easy-to-drink vitamins!,"A sweet, nutritious beverage."
351,Muscle Remedy,Harvey's special steroids. Removes exhaustion.,"When you've pushed your body too hard, drink this to remove 'Exhaustion'."
368,Basic Fertilizer,Your crops have a slight chance to grow larger in soil sprinkled with tree blood.,"Improves soil quality a little, increasing your chance to grow quality crops. Mix into tilled soil."
369,Quality Fertilizer,Improves the chance of higher quality harvests by repurposing dead fish.,"Improves soil quality, increasing your chance to grow quality crops. Mix into tilled soil."
370,Basic Retaining Soil,TODO,This soil has a chance of staying watered overnight. Mix into tilled soil.
371,Quality Retaining Soil,TODO,This soil has a good chance of staying watered overnight. Mix into tilled soil.
